;Caption;Population;True size;Comment;Source
229;2014 - 15 New York Rangers season: Roster | Injuries;closed;;past, closed time period;
230;EuroLeague All-Final Four Team: EuroLeague All-Final Four Team (1991 - 2001) | 1997 FIBA EuroLeague Final Four;closed;5;past, closed time period;sind immer 5
231;List of Malaysian films of 2008: 2008 | January  -  March;closed;;past, closed time period;
232;List of boundary changes in the West Midlands (region): Electoral boundaries | Further electoral reviews by the LGBCE;open;;electoral boundaries may change;
233;2016 - 17 ISU Junior Grand Prix: Overall standings | Standings per nation;closed;11;past, closed time period;https://isu.org/figure-skating/events/junior-grand-prix-of-figure-skating/jgp-archives/2016-17-4/15181-junior-grand-prix-standings-nation-2016-17/file
234;2015 - 16 Uruguayan Primera Divisi√≥n season: Championship playoff | Semifinal;closed;;past, closed time period;
235;U.S. Navy and U.S. Marine Corps Aircraft Tail Codes: List of Navy and Marine Aircraft Tail Codes;open;;new codes may be added;
236;HDD Jesenice: Season-by-season record;open;;active artist/athlete;
237;Major achievements in handball by nation: Results | Indoor handball, beach handball and field handball | Women;open;;list grows due to rank binding;
238;2016 Colchester Borough Council election: Ward Results | New Town & Christ Church;closed;;past, closed time period;
239;Two Yoo Project Sugar Man: List of episodes | Season 2;closed;20;past, closed time period;https://mydramalist.com/26874-two-yoo-project-sugar-man-season-2/episodes
240;2018 Colorado Rockies season: Regular season | Postseason Game Log;closed;;past, closed time period (table no longer exists);
241;2017 - 18 Women's Volleyball Thailand League: Teams | National team players;closed;;past, closed time period;
242;2017 Terengganu FA season: Squad information | First team squad;closed;25;past, closed time period;https://www.transfermarkt.com/terengganu-fc/startseite/verein/15838?saison_id=2017
243;2017 Quebec municipal elections: Laurentides | Sainte-Ad√®le, QuebecSainte-Ad√®le;closed;;past, closed time period;
244;JoJo Natson: College career;closed;;past, closed time period;
245;New Energy (album): Accolades;closed;;Chart positions of non-current pieces of music are considered closed;
246;Jo Hartley: TV;open;;active artist/athlete;
247;2017 Women's World Floorball Championships: Final ranking;closed;16;past, closed time period;http://floorball.org/wfc2017/#undefined
248;List of Presidents of the New York Public Library: Lenox Library;open;;continuous list, new items are added as new rows;
249;2017 - 18 Women's Volleyball Thailand League: Teams | Members;closed;10;past, closed time period;dbpedia
